{
  "version": 1,
  "source": {
    "provider": "Homebrew Formulae Analytics",
    "analytics_endpoint": "https://formulae.brew.sh/api/analytics/cask-install/365d.json",
    "metadata_endpoint": "https://formulae.brew.sh/api/cask.json",
    "window_days": 365,
    "start_date": "2025-09-08",
    "end_date": "2026-09-08",
    "total_cask_events": 25371569
  },
  "selection": {
    "denominator": 200,
    "rule": "First 200 analytics-ranked Homebrew/homebrew-cask entries whose current metadata contains an app artifact",
    "excludes": "CLI-only tools, fonts, runtimes, drivers, and third-party tap entries without official Formulae metadata"
  },
  "mechanisms": {
    "defaults_dominant": "CFPreferences is the leading recipe candidate",
    "file_driven": "User-owned structured or text files are the leading candidate",
    "hybrid": "More than one mechanism is expected",
    "cloud_or_opaque": "Cask metadata exposes no stable local configuration surface"
  },
  "applications": [
    {
      "analytics_rank": 4,
      "cask": "docker-desktop",
      "name": "Docker Desktop",
      "description": "App to build and share containerised applications and microservices",
      "homepage": "https://www.docker.com/products/docker-desktop",
      "installs": 540991,
      "percent": 2.13,
      "artifact_kinds": [
        "app",
        "bash_completion",
        "binary",
        "fish_completion",
        "postflight_steps",
        "target",
        "uninstall",
        "zap",
        "zsh_completion"
      ],
      "signals": {
        "preference_paths": [
          "~/Library/Preferences/com.docker.docker.plist",
          "~/Library/Preferences/com.electron.docker-frontend.plist",
          "~/Library/Preferences/com.electron.dockerdesktop.plist"
        ],
        "config_paths": [
          "~/.docker",
          "~/.docker/bin",
          "~/Library/Application Support/Docker Desktop",
          "~/Library/Application Support/com.bugsnag.Bugsnag/com.docker.docker",
          "~/Library/Application Support/docker-secrets-engine"
        ]
      },
      "behavior": {
        "mechanism": "hybrid",
        "confidence": "medium",
        "evidence": "homebrew_zap_paths",
        "note": "Candidate mechanism inferred from paths in the current Homebrew cask zap stanza; capture must confirm which state is user-owned."
      },
      "local_recipe": null,
      "rank": 1
    },
    {
      "analytics_rank": 5,
      "cask": "visual-studio-code",
      "name": "Microsoft Visual Studio Code",
      "description": "Open-source code editor",
      "homepage": "https://code.visualstudio.com/",
      "installs": 496266,
      "percent": 1.96,
      "artifact_kinds": [
        "app",
        "binary",
        "target",
        "uninstall",
        "zap"
      ],
      "signals": {
        "preference_paths": [
          "~/Library/Preferences/ByHost/com.microsoft.VSCode.ShipIt.*.plist",
          "~/Library/Preferences/com.microsoft.VSCode.helper.plist",
          "~/Library/Preferences/com.microsoft.VSCode.plist"
        ],
        "config_paths": [
          "~/.vscode",
          "~/Library/Application Support/Code"
        ]
      },
      "behavior": {
        "mechanism": "hybrid",
        "confidence": "high",
        "evidence": "curated",
        "note": "Settings are JSON/JSONC files; extensions converge through the code CLI."
      },
      "local_recipe": "vscode",
      "rank": 2
    },
    {
      "analytics_rank": 6,
      "cask": "google-chrome",
      "name": "Google Chrome",
      "description": "Web browser",
      "homepage": "https://www.google.com/chrome/",
      "installs": 450410,
      "percent": 1.78,
      "artifact_kinds": [
        "app",
        "target",
        "zap"
      ],
      "signals": {
        "preference_paths": [
          "~/Library/Preferences/com.google.Chrome.plist",
          "~/Library/Preferences/com.google.Keystone.Agent.plist"
        ],
        "config_paths": [
          "~/Library/Application Support/Google",
          "~/Library/Application Support/Google/Chrome"
        ]
      },
      "behavior": {
        "mechanism": "hybrid",
        "confidence": "medium",
        "evidence": "homebrew_zap_paths",
        "note": "Candidate mechanism inferred from paths in the current Homebrew cask zap stanza; capture must confirm which state is user-owned."
      },
      "local_recipe": null,
      "rank": 3
    },
    {
      "analytics_rank": 10,
      "cask": "ghostty",
      "name": "Ghostty",
      "description": "Terminal emulator that uses platform-native UI and GPU acceleration",
      "homepage": "https://ghostty.org/",
      "installs": 370796,
      "percent": 1.46,
      "artifact_kinds": [
        "app",
        "bash_completion",
        "fish_completion",
        "manpage",
        "target",
        "zap",
        "zsh_completion"
      ],
      "signals": {
        "preference_paths": [
          "~/Library/Preferences/com.mitchellh.ghostty.plist"
        ],
        "config_paths": [
          "~/.cache/ghostty",
          "~/.config/ghostty",
          "~/Library/Application Support/com.mitchellh.ghostty"
        ]
      },
      "behavior": {
        "mechanism": "file_driven",
        "confidence": "high",
        "evidence": "curated",
        "note": "User-owned text configuration under ~/.config/ghostty."
      },
      "local_recipe": "ghostty",
      "rank": 4
    },
    {
      "analytics_rank": 13,
      "cask": "libreoffice",
      "name": "LibreOffice",
      "description": "Free cross-platform office suite, fresh version",
      "homepage": "https://www.libreoffice.org/",
      "installs": 343209,
      "percent": 1.35,
      "artifact_kinds": [
        "app",
        "binary",
        "command_wrapper",
        "target",
        "zap"
      ],
      "signals": {
        "preference_paths": [
          "~/Library/Preferences/org.libreoffice.script.plist"
        ],
        "config_paths": [
          "~/Library/Application Support/LibreOffice"
        ]
      },
      "behavior": {
        "mechanism": "hybrid",
        "confidence": "medium",
        "evidence": "homebrew_zap_paths",
        "note": "Candidate mechanism inferred from paths in the current Homebrew cask zap stanza; capture must confirm which state is user-owned."
      },
      "local_recipe": null,
      "rank": 5
    },
    {
      "analytics_rank": 14,
      "cask": "iterm2",
      "name": "iTerm2",
      "description": "Terminal emulator as alternative to Apple's Terminal app",
      "homepage": "https://iterm2.com/",
      "installs": 325452,
      "percent": 1.28,
      "artifact_kinds": [
        "app",
        "target",
        "zap"
      ],
      "signals": {
        "preference_paths": [
          "~/Library/Preferences/com.googlecode.iterm2.plist",
          "~/Library/Preferences/com.googlecode.iterm2.private.plist"
        ],
        "config_paths": [
          "~/Library/Application Support/iTerm",
          "~/Library/Application Support/iTerm2"
        ]
      },
      "behavior": {
        "mechanism": "hybrid",
        "confidence": "high",
        "evidence": "curated",
        "note": "A dedicated JSON dynamic-profile file is safe to own; the global preference domains remain outside the recipe."
      },
      "local_recipe": "iterm2",
      "rank": 6
    },
    {
      "analytics_rank": 19,
      "cask": "claude",
      "name": "Claude",
      "description": "Anthropic's official Claude AI desktop app",
      "homepage": "https://claude.com/download",
      "installs": 211785,
      "percent": 0.83,
      "artifact_kinds": [
        "app",
        "target",
        "uninstall",
        "zap"
      ],
      "signals": {
        "preference_paths": [
          "~/Library/Preferences/com.anthropic.claudefordesktop.plist"
        ],
        "config_paths": [
          "~/Library/Application Support/Claude"
        ]
      },
      "behavior": {
        "mechanism": "hybrid",
        "confidence": "medium",
        "evidence": "homebrew_zap_paths",
        "note": "Candidate mechanism inferred from paths in the current Homebrew cask zap stanza; capture must confirm which state is user-owned."
      },
      "local_recipe": null,
      "rank": 7
    },
    {
      "analytics_rank": 20,
      "cask": "firefox",
      "name": "Mozilla Firefox",
      "description": "Web browser",
      "homepage": "https://www.mozilla.org/firefox/",
      "installs": 196871,
      "percent": 0.78,
      "artifact_kinds": [
        "app",
        "command_wrapper",
        "target",
        "uninstall",
        "zap"
      ],
      "signals": {
        "preference_paths": [
          "~/Library/Preferences/org.mozilla.crashreporter.plist",
          "~/Library/Preferences/org.mozilla.firefox.plist"
        ],
        "config_paths": [
          "~/Library/Application Support/CrashReporter/firefox_*",
          "~/Library/Application Support/Firefox",
          "~/Library/Application Support/Mozilla"
        ]
      },
      "behavior": {
        "mechanism": "hybrid",
        "confidence": "medium",
        "evidence": "homebrew_zap_paths",
        "note": "Candidate mechanism inferred from paths in the current Homebrew cask zap stanza; capture must confirm which state is user-owned."
      },
      "local_recipe": null,
      "rank": 8
    },
    {
      "analytics_rank": 22,
      "cask": "obsidian",
      "name": "Obsidian",
      "description": "Knowledge base that works on top of a local folder of plain text Markdown files",
      "homepage": "https://obsidian.md/",
      "installs": 191010,
      "percent": 0.75,
      "artifact_kinds": [
        "app",
        "binary",
        "target",
        "zap"
      ],
      "signals": {
        "preference_paths": [
          "~/Library/Preferences/md.obsidian.plist"
        ],
        "config_paths": [
          "~/Library/Application Support/obsidian"
        ]
      },
      "behavior": {
        "mechanism": "file_driven",